{
  "task_id": "REQ_RES_2026_01",
  "project_id": "SAV_DEP_2026_01",
  "created_at": "2026-10-17T10:10:00Z",
  "subqueries": [
    {
      "query": "средние ставки по вкладам до востребования в РФ, 2026",
      "target_tier": "TIER_1",
      "status": "DONE"
    },
    {
      "query": "требования ЦБ РФ к раскрытию МГС",
      "target_tier": "TIER_1",
      "status": "DONE"
    },
    {
      "query": "практика ФАС по мисселингу вкладов",
      "target_tier": "TIER_2",
      "status": "DONE"
    }
  ]
}
